root@lamp-s-1vcpu-1gb-tor1-01:~# tcpdump -c 5 -i eth0
tcpdump: verbose output suppressed, use -v or -vv for full protocol decode
listening on eth0, link-type EN10MB (Ethernet), capture size 262144 bytes
20:23:59.609064 IP lamp-s-1vcpu-1gb-tor1-01.ssh > 198.96.85.163.55625: Flags [P.], seq 3832710208:3832710316, ack 3967956923, win 313, length 108
20:23:59.609157 IP lamp-s-1vcpu-1gb-tor1-01.ssh > 198.96.85.163.55625: Flags [P.], seq 108:144, ack 1, win 313, length 36
20:23:59.609235 IP lamp-s-1vcpu-1gb-tor1-01.ssh > 198.96.85.163.55625: Flags [P.], seq 144:252, ack 1, win 313, length 108
20:23:59.609306 IP lamp-s-1vcpu-1gb-tor1-01.ssh > 198.96.85.163.55625: Flags [P.], seq 252:288, ack 1, win 313, length 36
20:23:59.610964 IP lamp-s-1vcpu-1gb-tor1-01.ssh > 198.96.85.163.55625: Flags [P.], seq 288:468, ack 1, win 313, length 180
5 packets captured
9 packets received by filter
0 packets dropped by kernel
