root@lamp-s-1vcpu-1gb-tor1-01:~# tcpdump -n -i eth0
20:29:42.397442 IP 159.89.127.140.22 > 198.96.85.163.55625: Flags [P.], seq 491648:491996, ack 289, win 313, length 348
20:29:42.397578 IP 159.89.127.140.22 > 198.96.85.163.55625: Flags [P.], seq 491996:492152, ack 289, win 313, length 156
20:29:42.397676 IP 159.89.127.140.22 > 198.96.85.163.55625: Flags [P.], seq 492152:492308, ack 289, win 313, length 156
20:29:42.397802 IP 159.89.127.140.22 > 198.96.85.163.55625: Flags [P.], seq 492308:492464, ack 289, win 313, length 156
20:29:42.397903 IP 159.89.127.140.22 > 198.96.85.163.55625: Flags [P.], seq 492464:492620, ack 289, win 313, length 156
20:29:42.398000 IP 159.89.127.140.22 > 198.96.85.163.55625: Flags [P.], seq 492620:492776, ack 289, win 313, length 156
20:29:42.398097 IP 159.89.127.140.22 > 198.96.85.163.55625: Flags [P.], seq 492776:492932, ack 289, win 313, length 156
20:29:42.398194 IP 159.89.127.140.22 > 198.96.85.163.55625: Flags [P.], seq 492932:493088, ack 289, win 313, length 156
20:29:42.398293 IP 159.89.127.140.22 > 198.96.85.163.55625: Flags [P.], seq 493088:493244, ack 289, win 313, length 156
20:29:42.398389 IP 159.89.127.140.22 > 198.96.85.163.55625: Flags [P.], seq 493244:493400, ack 289, win 313, length 156
20:29:42.398485 IP 159.89.127.140.22 > 198.96.85.163.55625: Flags [P.], seq 493400:493556, ack 289, win 313, length 156
20:29:42.398508 IP 198.96.85.163.55625 > 159.89.127.140.22: Flags [.], ack 489464, win 2051, length 0
20:29:42.398621 IP 198.96.85.163.55625 > 159.89.127.140.22: Flags [.], ack 489776, win 2050, length 0
20:29:42.398636 IP 198.96.85.163.55625 > 159.89.127.140.22: Flags [.], ack 490088, win 2049, length 0
20:29:42.398665 IP 159.89.127.140.22 > 198.96.85.163.55625: Flags [P.], seq 493556:493712, ack 289, win 313, length 156
20:29:42.398710 IP 159.89.127.140.22 > 198.96.85.163.55625: Flags [P.], seq 493712:493972, ack 289, win 313, length 260
20:29:42.398818 IP 198.96.85.163.55625 > 159.89.127.140.22: Flags [.], ack 490400, win 2047, length 0
20:29:42.398944 IP 159.89.127.140.22 > 198.96.85.163.55625: Flags [P.], seq 493972:494560, ack 289, win 313, length 588
20:29:42.399057 IP 159.89.127.140.22 > 198.96.85.163.55625: Flags [P.], seq 494560:494716, ack 289, win 313, length 156
20:29:42.399084 IP 198.96.85.163.55625 > 159.89.127.140.22: Flags [.], ack 491024, win 2051, length 0
20:29:42.399093 IP 198.96.85.163.55625 > 159.89.127.140.22: Flags [.], ack 491336, win 2050, length 0
20:29:42.399239 IP 159.89.127.140.22 > 198.96.85.163.55625: Flags [P.], seq 494716:495080, ack 289, win 313, length 364
20:29:42.399357 IP 159.89.127.140.22 > 198.96.85.163.55625: Flags [P.], seq 495080:495236, ack 289, win 313, length 156
20:29:42.399463 IP 159.89.127.140.22 > 198.96.85.163.55625: Flags [P.], seq 495236:495392, ack 289, win 313, length 156
20:29:42.399569 IP 159.89.127.140.22 > 198.96.85.163.55625: Flags [P.], seq 495392:495548, ack 289, win 313, length 156
20:29:42.399675 IP 159.89.127.140.22 > 198.96.85.163.55625: Flags [P.], seq 495548:495704, ack 289, win 313, length 156
20:29:42.399797 IP 159.89.127.140.22 > 198.96.85.163.55625: Flags [P.], seq 495704:495860, ack 289, win 313, length 156
20:29:42.399967 IP 159.89.127.140.22 > 198.96.85.163.55625: Flags [P.], seq 495860:496016, ack 289, win 313, length 156
20:29:42.400127 IP 159.89.127.140.22 > 198.96.85.163.55625: Flags [P.], seq 496016:496172, ack 289, win 313, length 156
20:29:42.400302 IP 159.89.127.140.22 > 198.96.85.163.55625: Flags [P.], seq 496172:496328, ack 289, win 313, length 156
20:29:42.400424 IP 159.89.127.140.22 > 198.96.85.163.55625: Flags [P.], seq 496328:496484, ack 289, win 313, length 156
20:29:42.400533 IP 159.89.127.140.22 > 198.96.85.163.55625: Flags [P.], seq 496484:496640, ack 289, win 313, length 156
20:29:42.400640 IP 159.89.127.140.22 > 198.96.85.163.55625: Flags [P.], seq 496640:496796, ack 289, win 313, length 156
20:29:42.400749 IP 159.89.127.140.22 > 198.96.85.163.55625: Flags [P.], seq 496796:496952, ack 289, win 313, length 156
20:29:42.400855 IP 159.89.127.140.22 > 198.96.85.163.55625: Flags [P.], seq 496952:497108, ack 289, win 313, length 156
20:29:42.401041 IP 159.89.127.140.22 > 198.96.85.163.55625: Flags [P.], seq 497108:497264, ack 289, win 313, length 156
20:29:42.401152 IP 159.89.127.140.22 > 198.96.85.163.55625: Flags [P.], seq 497264:497420, ack 289, win 313, length 156
20:29:42.401282 IP 159.89.127.140.22 > 198.96.85.163.55625: Flags [P.], seq 497420:497576, ack 289, win 313, length 156
20:29:42.401391 IP 159.89.127.140.22 > 198.96.85.163.55625: Flags [P.], seq 497576:497732, ack 289, win 313, length 156
20:29:42.401506 IP 159.89.127.140.22 > 198.96.85.163.55625: Flags [P.], seq 497732:497888, ack 289, win 313, length 156
20:29:42.401615 IP 159.89.127.140.22 > 198.96.85.163.55625: Flags [P.], seq 497888:498044, ack 289, win 313, length 156
20:29:42.401721 IP 159.89.127.140.22 > 198.96.85.163.55625: Flags [P.], seq 498044:498200, ack 289, win 313, length 156
20:29:42.401791 IP 198.96.85.163.55625 > 159.89.127.140.22: Flags [.], ack 491648, win 2049, length 0
20:29:42.401811 IP 198.96.85.163.55625 > 159.89.127.140.22: Flags [.], ack 492152, win 2047, length 0
20:29:42.401817 IP 198.96.85.163.55625 > 159.89.127.140.22: Flags [.], ack 492464, win 2051, length 0
20:29:42.401823 IP 198.96.85.163.55625 > 159.89.127.140.22: Flags [.], ack 492776, win 2050, length 0
20:29:42.402002 IP 159.89.127.140.22 > 198.96.85.163.55625: Flags [P.], seq 498200:498772, ack 289, win 313, length 572
20:29:42.402124 IP 198.96.85.163.55625 > 159.89.127.140.22: Flags [P.], seq 289:325, ack 492932, win 2049, length 36
^C
3572 packets captured
3669 packets received by filter
96 packets dropped by kernel
