root@lamp-s-1vcpu-1gb-tor1-01:~# tcpdump -r 0001.pcap
reading from file 0001.pcap, link-type EN10MB (Ethernet)
20:27:51.309369 IP lamp-s-1vcpu-1gb-tor1-01.ssh > 198.96.85.163.55625: Flags [P.], seq 3858383024:3858383068, ack 3967975379, win 313, length 44
20:27:51.309532 IP lamp-s-1vcpu-1gb-tor1-01.ssh > 198.96.85.163.55625: Flags [P.], seq 44:152, ack 1, win 313, length 108
20:27:51.309617 IP lamp-s-1vcpu-1gb-tor1-01.ssh > 198.96.85.163.55625: Flags [P.], seq 152:188, ack 1, win 313, length 36
20:27:51.312818 IP 198.96.85.163.55625 > lamp-s-1vcpu-1gb-tor1-01.ssh: Flags [.], ack 44, win 2049, length 0
20:27:51.312943 IP 198.96.85.163.55625 > lamp-s-1vcpu-1gb-tor1-01.ssh: Flags [.], ack 188, win 2048, length 0
20:28:00.476514 IP scan-24.security.ipip.net.50268 > lamp-s-1vcpu-1gb-tor1-01.8000: Flags [S], seq 669166150, win 65535, length 0
